{
  "as_of_date": "2026-09-23",
  "warehouse_id": "demo-almaty",
  "data_source": "synthetic",
  "review_period_days": 14,
  "suppliers": [
    {"supplier_id": "supplier-a", "name": "Синтетический поставщик A", "lead_time_days": 7},
    {"supplier_id": "supplier-b", "name": "Синтетический поставщик B", "lead_time_days": 12}
  ],
  "products": [
    {"sku": "CABLE-01", "name": "Кабель, учебный SKU", "category": "cable", "supplier_id": "supplier-a", "current_stock": 12, "goods_in_transit": 5, "growth_forecast_pct": 0},
    {"sku": "LAMP-02", "name": "Светильник, учебный SKU", "category": "lighting", "supplier_id": "supplier-b", "current_stock": 0, "goods_in_transit": 0, "growth_forecast_pct": 5},
    {"sku": "SWITCH-03", "name": "Выключатель, учебный SKU", "category": "switches", "supplier_id": "supplier-a", "current_stock": 4, "goods_in_transit": 2, "growth_forecast_pct": 0}
  ],
  "sales": [
    {"date": "2026-09-02", "sku": "CABLE-01", "quantity": 3, "document_id": "demo-1"},
    {"date": "2026-09-03", "sku": "CABLE-01", "quantity": 4, "document_id": "demo-2"},
    {"date": "2026-09-04", "sku": "CABLE-01", "quantity": 3, "document_id": "demo-3"},
    {"date": "2026-09-05", "sku": "CABLE-01", "quantity": 60, "document_id": "demo-bulk"},
    {"date": "2026-09-06", "sku": "CABLE-01", "quantity": 4, "document_id": "demo-4"},
    {"date": "2026-09-02", "sku": "LAMP-02", "quantity": 2, "document_id": "demo-5"},
    {"date": "2026-09-03", "sku": "LAMP-02", "quantity": 3, "document_id": "demo-6"},
    {"date": "2026-09-04", "sku": "LAMP-02", "quantity": 2, "document_id": "demo-7"},
    {"date": "2026-09-10", "sku": "LAMP-02", "quantity": 3, "document_id": "demo-8"},
    {"date": "2026-09-02", "sku": "SWITCH-03", "quantity": 2, "document_id": "demo-9"},
    {"date": "2026-09-09", "sku": "SWITCH-03", "quantity": 3, "document_id": "demo-10"}
  ],
  "stockouts": [
    {"sku": "LAMP-02", "start_date": "2026-09-05", "end_date": "2026-09-09"}
  ]
}
